38,South America,Anguilla,ACTIVE,Sep 2020,"Through their Beyond Extraordinary Anguilla program [link], interested remote workers can stay for a year in this British island territory located in the West Indies.
Be wary though that it’s a bit of a remote area so it’s not as 
well-connected as other destinations; not to mention that the visa fee 
is costly.",https://escape.ivisitanguilla.com/work-from-anguilla/,All nationalities,3 months to a year,"$2,000",None (but submit proof of employment),Yes (purchase either from SafetyWing or HeyMondo),https://borderless.safetywing.com/anguilla?referenceID=iamaileen&utm_source=iamaileen&utm_medium=Ambassador,2000,25
39,South America,Antigua & Barbuda,ACTIVE,October 2020,"Through their newest long-stay visa program, the “Nomad Digital Residence” (NDR) [link] is designed to attract remote workers to this quaint Caribbean island.
It has a long validity than most, but the application cost is hefty — like the rest of the countries in this list.",https://antiguanomadresidence.com/,All nationalities,2 years,"$1,500 or $2,000 for a couple and $3,000 for a family","$50,000 per year",Yes (purchase either from SafetyWing or HeyMondo),https://borderless.safetywing.com/antigua-and-barbuda?referenceID=iamaileen&utm_source=iamaileen&utm_medium=Ambassador,4000,15
40,South America,Bahamas,ACTIVE,Mar 2021,"The 16 islands are a tax-free haven and with their Bahamas Extended Access Travel Stay (BEATS) programme [link], you can stay for a long time enjoying its gorgeous beaches!
Be prepared to shell out a lot of money because apart from the fact 
that the cost of living is high in the Bahamas, the visa fee is high 
too.",https://www.bahamasbeats.com/,All nationalities,"1 year, renewable to a maximum of 3 years total","$25 for every applicant, and $1,000 plus $500 for every dependent",Uknown,Yes (purchase either from SafetyWing or HeyMondo),https://borderless.safetywing.com/bahamas?referenceID=iamaileen&utm_source=iamaileen&utm_medium=Ambassador,4400,35
41,South America,Barbados,ACTIVE,July 2020,Live the island life in Barbados through their special ‘Barbados Welcome Stamp’ visa [link] that is catered for remote workers. You will find that the application for this is super quick and easy — everything can be done online!,https://www.visitbarbados.org/barbados-welcome-stamp,All nationalities,"1 year, renewable","$2,000 for an individual, $3,000 for a couple or family","$50,000 per year",Yes (purchase either from SafetyWing or HeyMondo),https://borderless.safetywing.com/barbados?referenceID=iamaileen&utm_source=iamaileen&utm_medium=Ambassador,4400,70
42,South America,Bermuda ,ACTIVE,Unknown,"Bermuda is the most expensive country on earth — BUT, if this is a place that you’d love to be in (and which you can also afford to be in), their newest ‘Work from Bermuda’ visa program [link] is perfect for you.",https://www.gotobermuda.com/workfrombermuda,All nationalities,1 year,$263,None  ,Yes (purchase either from SafetyWing or HeyMondo),https://borderless.safetywing.com/bermuda?referenceID=iamaileen&utm_source=iamaileen&utm_medium=Ambassador,7000,20
43,South America,Cayman Islands,ACTIVE,Aug 2020,"Guaranteeing a 2-year stay, the Cayman Islands’ ‘Global Citizen Concierge Program’ [link] is a new initiative, but it’s seemingly geared mostly for high-earning remote workers only given the required income that you need to prove.",https://www.visitcaymanislands.com/en-gb/global-citizen-concierge,All nationalities,2  years,"$1,469","$100,000 per year for an individual, $150,000 for a couple, $180,000 for a family",Yes (purchase either from SafetyWing or HeyMondo),https://borderless.safetywing.com/?referenceID=iamaileen&utm_source=iamaileen&utm_medium=Ambassador,6500,15
44,South America,Curaco,ACTIVE,Feb 2021,"The government of Curacao now allows remote workers special access to
 work and life in its borders with its ‘@HOME in Curacao’ program [link].
If you’re up for it, you’ll love the multicultural mix of residents in this Dutch Caribbean island!",https://athomeincuracao.com/remote-workers,All nationalities,"6 months, renewable for another 6 months",$294,"Unknown, but you must prove your solvency",Yes (purchase either from SafetyWing or HeyMondo),https://borderless.safetywing.com/?referenceID=iamaileen&utm_source=iamaileen&utm_medium=Ambassador,2000,15
45,South America,Dominica,ACTIVE,March 2021,"If you plan to stay in the Caribbean, the Commonwealth of Dominica (not to be confused with the Dominican Republic) is your best bet if you want a cheaper cost of living.
And with their newest ‘Work in Nature’ (WIN) [link] visa program, remote freelancers and digital nomads can stay for a long period.",https://windominica.gov.dm/,All nationalities,Up to 18 months,"$100 plus $800 for individuals or $1,200 for a family","$70,000 per year",Yes (purchase either from SafetyWing or HeyMondo),https://borderless.safetywing.com/dominica?referenceID=iamaileen&utm_source=iamaileen&utm_medium=Ambassador,1500,65
46,South America,Grenada,PENDING,,"In May 2021, Grenada approved a legislation that will establish a digital nomad visa program.
It should have been live by October [link]; however, as of 2022, no further announcements have been made.",https://www.nowgrenada.com/2021/05/grenada-approves-remote-working-legislation/,All nationalities,"1 year, renewable for 1 more year","$1,500 per person (or $2,000 for a family with 3 children; $200 for every additional dependent)","$37,000 per year",Unknown,https://borderless.safetywing.com/grenada?referenceID=iamaileen&utm_source=iamaileen&utm_medium=Ambassador,2500,50
47,South America,Monteserrat,ACTIVE,Jan 2021,"This mountainous Caribbean island launched their ‘Montserrat Remote Work Stamp’ [link] and after only 7 days of visa processing, you can live there as a digital nomad for a year!
As a bonus, you will not be liable to pay any Montserrat income tax.",https://montserratremoteworker.com/,All nationalities,"1 year, renewable",$500 per person (or $750 for a family with 3 children; $250 for every additional dependent),"$70,000 per year",Yes (purchase either from SafetyWing or HeyMondo),https://borderless.safetywing.com/montserrat?referenceID=iamaileen&utm_source=iamaileen&utm_medium=Ambassador,1500,30
48,South America,Saint Lucia,ACTIVE,Apr 2021,"With visa-free travel for nationalities from the USA, Canada, and the
 UK, Saint Lucia is an ideal location for tourists — add their new 
scheme ‘Saint Lucia Live It’ and anyone can stay for a year with a 
multiple-entry non-immigrant visa whilst working remotely.
To apply, you only need to fill out this application form and submit it to this email: visaoffice@police.govt.lc",https://34a1ju2gva4u3yrm051vedfb-wpengine.netdna-ssl.com/wp-content/uploads/2021/07/SaintLuciaVisaApplicationForm.pdf,All nationalities,"1 year, multiple-entry",$75 per person,None,Yes (purchase either from SafetyWing or HeyMondo),https://borderless.safetywing.com/saint-lucia?referenceID=iamaileen&utm_source=iamaileen&utm_medium=Ambassador,2500,50
